A1: Element | B1: Purpose | C1: Section | D1: Support | E1: Comments | F1: Implemented | G1: Aux | H1: Qualification
A2: <assign> | B2: Assign a variable a value | C2: 5.3.2 | D2: Full | F2: =IF(D2="None",0,1) -> 1 | G2: 1 | H2: =MATCH(D2,{"None","Initial","Functional","Full"},0) - 1 -> 3
A3: <audio> | B3: Play an audio clip within a prompt | C3: 4.1.3 | D3: None | F3: =IF(D3="None",0,1) -> 0 | G3: 1 | H3: =MATCH(D3,{"None","Initial","Functional","Full"},0) - 1 -> 0
A4: <block> | B4: A container of (non-interactive) executable code | C4: 2.3.1 | D4: Functional | E4: expr isn't implemented yet | F4: =IF(D4="None",0,1) -> 1 | G4: 1 | H4: =MATCH(D4,{"None","Initial","Functional","Full"},0) - 1 -> 2
A5: <catch> | B5: Catch an event | C5: 5.2.2 | D5: Functional | E5: Cann't catch events when those events were thrown inside catch,filled,noinput, etc. | F5: =IF(D5="None",0,1) -> 1 | G5: 1 | H5: =MATCH(D5,{"None","Initial","Functional","Full"},0) - 1 -> 2
A6: <choice> | B6: Define a menu item | C6: 2.2 | D6: Initial | E6: Only dtmf, next and expr are implemented and it doesn't evaluate childs | F6: =IF(D6="None",0,1) -> 1 | G6: 1 | H6: =MATCH(D6,{"None","Initial","Functional","Full"},0) - 1 -> 1
A7: <clear> | B7: Clear one or more form item variables | C7: 5.3.3 | D7: Initial | E7: It's coded but it's not working | F7: =IF(D7="None",0,1) -> 1 | G7: 1 | H7: =MATCH(D7,{"None","Initial","Functional","Full"},0) - 1 -> 1
A8: <disconnect> | B8: Disconnect a session | C8: 5.3.11 | D8: Full | F8: =IF(D8="None",0,1) -> 1 | G8: 1 | H8: =MATCH(D8,{"None","Initial","Functional","Full"},0) - 1 -> 3
A9: <else> | B9: Used in <if> elements | C9: 5.3.4 | D9: Full | F9: =IF(D9="None",0,1) -> 1 | G9: 1 | H9: =MATCH(D9,{"None","Initial","Functional","Full"},0) - 1 -> 3
A10: <elseif> | B10: Used in <if> elements | C10: 5.3.4 | D10: Full | F10: =IF(D10="None",0,1) -> 1 | G10: 1 | H10: =MATCH(D10,{"None","Initial","Functional","Full"},0) - 1 -> 3
A11: <enumerate> | B11: Shorthand for enumerating the choices in a menu | C11: 2.2 | D11: None | F11: =IF(D11="None",0,1) -> 0 | G11: 1 | H11: =MATCH(D11,{"None","Initial","Functional","Full"},0) - 1 -> 0
A12: <error> | B12: Catch an error event | C12: 5.2.3 | D12: Full | E12: BUG: See the catch comments | F12: =IF(D12="None",0,1) -> 1 | G12: 1 | H12: =MATCH(D12,{"None","Initial","Functional","Full"},0) - 1 -> 3
A13: <exit> | B13: Exit a session | C13: 5.3.9 | D13: None | F13: =IF(D13="None",0,1) -> 0 | G13: 1 | H13: =MATCH(D13,{"None","Initial","Functional","Full"},0) - 1 -> 0
A14: <field> | B14: Declares an input field in a form | C14: 2.3.1 | D14: Initial | E14: Only name and expr attributes are implemented | F14: =IF(D14="None",0,1) -> 1 | G14: 1 | H14: =MATCH(D14,{"None","Initial","Functional","Full"},0) - 1 -> 1
A15: <filled> | B15: An action executed when fields are filled | C15: 2.4 | D15: Full | E15: BUG: See the catch comments | F15: =IF(D15="None",0,1) -> 1 | G15: 1 | H15: =MATCH(D15,{"None","Initial","Functional","Full"},0) - 1 -> 3
A16: <form> | B16: A dialog for presenting information and collecting data | C16: 2.1 | D16: Functional | E16: Scope isn't implemented yet | F16: =IF(D16="None",0,1) -> 1 | G16: 1 | H16: =MATCH(D16,{"None","Initial","Functional","Full"},0) - 1 -> 2
A17: <goto> | B17: Go to another dialog in the same or different document | C17: 5.3.7 | D17: Functional | E17: Only next, expr, nextitem and expritem are implemented | F17: =IF(D17="None",0,1) -> 1 | G17: 1 | H17: =MATCH(D17,{"None","Initial","Functional","Full"},0) - 1 -> 2
A18: <grammar> | B18: Specify a speech recognition or DTMF grammar | C18: 3.1 | D18: None | F18: =IF(D18="None",0,1) -> 0 | G18: 1 | H18: =MATCH(D18,{"None","Initial","Functional","Full"},0) - 1 -> 0
A19: <help> | B19: Catch a help event | C19: 5.2.3 | D19: Full | E19: BUG: See the catch comments | F19: =IF(D19="None",0,1) -> 1 | G19: 1 | H19: =MATCH(D19,{"None","Initial","Functional","Full"},0) - 1 -> 3
A20: <if> | B20: Simple conditional logic | C20: 5.3.4 | D20: Full | E20: BUG: See the catch comments | F20: =IF(D20="None",0,1) -> 1 | G20: 1 | H20: =MATCH(D20,{"None","Initial","Functional","Full"},0) - 1 -> 3
A21: <initial> | B21: Declares initial logic upon entry into a (mixed-initiative) form | C21: 2.3.3 | D21: None | F21: =IF(D21="None",0,1) -> 0 | G21: 1 | H21: =MATCH(D21,{"None","Initial","Functional","Full"},0) - 1 -> 0
A22: <link> | B22: Specify a transition common to all dialogs in the link’s scope | C22: 2.5 | D22: None | F22: =IF(D22="None",0,1) -> 0 | G22: 1 | H22: =MATCH(D22,{"None","Initial","Functional","Full"},0) - 1 -> 0
A23: <log> | B23: Generate a debug message | C23: 5.3.13 | D23: None | F23: =IF(D23="None",0,1) -> 0 | G23: 1 | H23: =MATCH(D23,{"None","Initial","Functional","Full"},0) - 1 -> 0
A24: <menu> | B24: A dialog for choosing amongst alternative destinations | C24: 2.2 | D24: Initial | E24: Only id is implemented | F24: =IF(D24="None",0,1) -> 1 | G24: 1 | H24: =MATCH(D24,{"None","Initial","Functional","Full"},0) - 1 -> 1
A25: <meta> | B25: Define a meta data item as a name/value pair | C25: 6.2 | D25: Full | E25: The item values are loaded but they are not useful right now | F25: =IF(D25="None",0,1) -> 1 | G25: 1 | H25: =MATCH(D25,{"None","Initial","Functional","Full"},0) - 1 -> 3
A26: <noinput> | B26: Catch a noinput event | C26: 5.2.3 | D26: Full | E26: BUG: See the catch comments | F26: =IF(D26="None",0,1) -> 1 | G26: 1 | H26: =MATCH(D26,{"None","Initial","Functional","Full"},0) - 1 -> 3
A27: <nomatch> | B27: Catch a nomatch event | C27: 5.2.3 | D27: Full | E27: BUG: See the catch comments | F27: =IF(D27="None",0,1) -> 1 | G27: 1 | H27: =MATCH(D27,{"None","Initial","Functional","Full"},0) - 1 -> 3
A28: <object> | B28: Interact with a custom extension | C28: 2.3.5 | D28: None | F28: =IF(D28="None",0,1) -> 0 | G28: 1 | H28: =MATCH(D28,{"None","Initial","Functional","Full"},0) - 1 -> 0
A29: <option> | B29: Specify an option in a <field> | C29: 2.3 | D29: None | F29: =IF(D29="None",0,1) -> 0 | G29: 1 | H29: =MATCH(D29,{"None","Initial","Functional","Full"},0) - 1 -> 0
A30: <param> | B30: Parameter in <object> or <subdialog> | C30: 6.4 | D30: None | F30: =IF(D30="None",0,1) -> 0 | G30: 1 | H30: =MATCH(D30,{"None","Initial","Functional","Full"},0) - 1 -> 0
A31: <prompt> | B31: Queue speech synthesis and audio output to the user | C31: 4.1 | D31: Initial | E31: Only cond and count are implemented | F31: =IF(D31="None",0,1) -> 1 | G31: 1 | H31: =MATCH(D31,{"None","Initial","Functional","Full"},0) - 1 -> 1
A32: <property> | B32: Control implementation platform settings. | C32: 6.3 | D32: Full | E32: The settings values are loaded but they are not useful right now | F32: =IF(D32="None",0,1) -> 1 | G32: 1 | H32: =MATCH(D32,{"None","Initial","Functional","Full"},0) - 1 -> 3
A33: <record> | B33: Record an audio sample | C33: 2.3.6 | D33: None | F33: =IF(D33="None",0,1) -> 0 | G33: 1 | H33: =MATCH(D33,{"None","Initial","Functional","Full"},0) - 1 -> 0
A34: <reprompt> | B34: Play a field prompt when a field is re-visited after an event | C34: 5.3.6 | D34: None | F34: =IF(D34="None",0,1) -> 0 | G34: 1 | H34: =MATCH(D34,{"None","Initial","Functional","Full"},0) - 1 -> 0
A35: <return> | B35: Return from a subdialog. | C35: 5.3.10 | D35: None | F35: =IF(D35="None",0,1) -> 0 | G35: 1 | H35: =MATCH(D35,{"None","Initial","Functional","Full"},0) - 1 -> 0
A36: <script> | B36: Specify a block of ECMAScript client-side scripting logic | C36: 5.3.12 | D36: Initial | E36: No attributes are implemented right now, but it's childs are evaluated | F36: =IF(D36="None",0,1) -> 1 | G36: 1 | H36: =MATCH(D36,{"None","Initial","Functional","Full"},0) - 1 -> 1
A37: <subdialog> | B37: Invoke another dialog as a subdialog of the current one | C37: 2.3.4 | D37: None | F37: =IF(D37="None",0,1) -> 0 | G37: 1 | H37: =MATCH(D37,{"None","Initial","Functional","Full"},0) - 1 -> 0
A38: <submit> | B38: Submit values to a document server | C38: 5.3.8 | D38: None | F38: =IF(D38="None",0,1) -> 0 | G38: 1 | H38: =MATCH(D38,{"None","Initial","Functional","Full"},0) - 1 -> 0
A39: <throw> | B39: Throw an event. | C39: 5.2.1 | D39: Full | E39: Warning: because of a bug in the catch events thrown inside a catch are not catched where (and when) they should be | F39: =IF(D39="None",0,1) -> 1 | G39: 1 | H39: =MATCH(D39,{"None","Initial","Functional","Full"},0) - 1 -> 3
A40: <transfer> | B40: Transfer the caller to another destination | C40: 2.3.7 | D40: None | F40: =IF(D40="None",0,1) -> 0 | G40: 1 | H40: =MATCH(D40,{"None","Initial","Functional","Full"},0) - 1 -> 0
A41: <value> | B41: Insert the value of an expression in a prompt | C41: 4.1.4 | D41: Full | F41: =IF(D41="None",0,1) -> 1 | G41: 1 | H41: =MATCH(D41,{"None","Initial","Functional","Full"},0) - 1 -> 3
A42: <var> | B42: Declare a variable | C42: 5.3.1 | D42: Full | F42: =IF(D42="None",0,1) -> 1 | G42: 1 | H42: =MATCH(D42,{"None","Initial","Functional","Full"},0) - 1 -> 3
A43: <vxml> | B43: Top-level element in each VoiceXML document | C43: 1.5.1 | D43: Functional | E43: None of it's attributes are implemented including application that is maybe the most critical. Altough childs are evaluated | F43: =IF(D43="None",0,1) -> 1 | G43: 1 | H43: =MATCH(D43,{"None","Initial","Functional","Full"},0) - 1 -> 2
F44: =SUM(F2:F43) -> 26 | G44: =SUM(G2:G43) -> 42 | H44: =SUM(H2:H43) -> 61
A46: Support level | B46: Description | D46: =CONCATENATE(H46,"% of especification has been implemented") -> 48% of especification has been implemented | F46: =ROUND(100 * F44/G44,0) -> 62 | G46: =G44*3 -> 126 | H46: =ROUND(100 * H44/G46,0) -> 48
A47: None | B47: This element is not supported
A48: Initial | B48: Works but some important features are missing | D48: =CONCATENATE(G44-F44," Elements out of ", F44," have no implementation yet") -> 16 Elements out of 26 have no implementation yet
A49: Functional | B49: Works but some irrelevant features are missing
A50: Full | B50: This element is full supported